{
  "version": 1,
  "locale": "zh-Hans",
  "regionCode": "US-CA-SOCAL",
  "slots": [
    {
      "key": "hero",
      "kind": "HERO",
      "enabled": true,
      "source": {
        "contentKey": "homepage.hero",
        "imageAssetKey": "homepage/hero-socal"
      },
      "limit": 1,
      "cacheTtlSeconds": 300
    },
    {
      "key": "hot-searches",
      "kind": "HOT_SEARCHES",
      "enabled": true,
      "source": {
        "window": "DAY_1",
        "regionScoped": true
      },
      "limit": 7,
      "cacheTtlSeconds": 120
    },
    {
      "key": "hot-cities",
      "kind": "CITY_CHIPS",
      "enabled": true,
      "source": {
        "regionType": "CITY"
      },
      "limit": 8,
      "cacheTtlSeconds": 3600
    },
    {
      "key": "jobs-latest",
      "kind": "LISTING_FEED",
      "enabled": true,
      "source": {
        "listingType": "JOB",
        "sort": "NEWEST"
      },
      "limit": 5,
      "cacheTtlSeconds": 60
    },
    {
      "key": "rentals-latest",
      "kind": "LISTING_FEED",
      "enabled": true,
      "source": {
        "listingType": "RENTAL",
        "sort": "NEWEST"
      },
      "limit": 5,
      "cacheTtlSeconds": 60
    },
    {
      "key": "transfers-latest",
      "kind": "LISTING_FEED",
      "enabled": true,
      "source": {
        "listingType": "TRANSFER",
        "sort": "NEWEST"
      },
      "limit": 5,
      "cacheTtlSeconds": 60
    },
    {
      "key": "secondhand-latest",
      "kind": "LISTING_FEED",
      "enabled": true,
      "source": {
        "listingType": "SECONDHAND",
        "sort": "NEWEST"
      },
      "limit": 5,
      "cacheTtlSeconds": 60
    },
    {
      "key": "homepage-right-ad",
      "kind": "AD",
      "enabled": true,
      "source": {
        "placementKey": "home.right-rail"
      },
      "limit": 1,
      "sponsoredDisclosure": true,
      "cacheTtlSeconds": 30
    },
    {
      "key": "businesses-featured",
      "kind": "BUSINESS_CAROUSEL",
      "enabled": true,
      "source": {
        "verifiedOnly": true
      },
      "limit": 4,
      "sponsoredDisclosure": true,
      "cacheTtlSeconds": 300
    },
    {
      "key": "providers-recommended",
      "kind": "PROVIDER_CAROUSEL",
      "enabled": true,
      "source": {
        "verifiedOnly": true
      },
      "limit": 4,
      "sponsoredDisclosure": false,
      "cacheTtlSeconds": 300
    },
    {
      "key": "price-center",
      "kind": "PRICE_METRIC",
      "enabled": true,
      "source": {
        "metricKeys": ["RENTAL_MEDIAN", "WAGE_MEDIAN", "SERVICE_PRICE_MEDIAN"]
      },
      "limit": 5,
      "cacheTtlSeconds": 3600
    },
    {
      "key": "cross-border-products",
      "kind": "RESOURCE_PRODUCTS",
      "enabled": false,
      "source": {
        "collectionKey": "cross-border-products"
      },
      "limit": 3,
      "sponsoredDisclosure": true,
      "cacheTtlSeconds": 300
    }
  ]
}
